{
  "id": "d013",
  "version": 1,
  "title": "The Relief List",
  "subtitle": "Flood relief reached one lane and not the next; the list is being called rigged",
  "dilemmaKey": "relief-fairness",
  "themeTags": [
    "relief",
    "fairness",
    "records"
  ],
  "focus": "transit",
  "institution": "civic",
  "mood": "tense",
  "opponents": [
    "exploiter",
    "disinfo"
  ],
  "coldOpen": [
    "Three days after the flood, relief kits reached Lane 2.",
    "Lane 3, just as wet, got nothing.",
    "A list with names is being passed hand to hand."
  ],
  "briefing": {
    "grievance": "Families in Lane 3 lost as much as Lane 2 and received nothing. They believe the relief list was written for someone’s voters. They want kits today and the list explained.",
    "knownFacts": [
      "Lane 2 received 180 kits on Tuesday; Lane 3 received none.",
      "The survey team marked Lane 3 “pending” because the lane was still flooded on survey day.",
      "A second consignment of 400 kits is at the collectorate warehouse."
    ],
    "unverifiedClaims": [
      "A post says a councillor’s relatives got double kits.",
      "A message says Lane 3 was skipped on purpose for the way it voted."
    ],
    "responsibility": "You run the relief operation and the survey office. Kits and fairness both run through you.",
    "objective": "Get Lane 3 its kits today, show how the list was made, and stop the favouritism story from becoming a fight."
  },
  "evidence": [
    {
      "id": "ev-d013-1",
      "title": "Survey sheet, Lanes 2 and 3",
      "source": "Relief survey team",
      "sourceType": "official",
      "time": "09:00",
      "claim": "Lane 2 surveyed Monday, 180 households; Lane 3 marked “pending, water-logged”, revisit due Thursday.",
      "initialState": "verified",
      "truth": "true",
      "resolvedState": "verified",
      "metadata": [
        {
          "label": "Lane 2",
          "value": "180 households, Monday"
        },
        {
          "label": "Lane 3",
          "value": "“Pending”, revisit Thursday"
        }
      ],
      "visual": {
        "type": "document",
        "caption": "A survey sheet with one lane marked pending"
      },
      "resolutionNote": "Lane 3 was skipped because it was still under water, not because of how it voted.",
      "availableAt": 2,
      "district": "transit",
      "simple": {
        "title": "The survey sheet",
        "claim": "Lane 2 was surveyed Monday. Lane 3 was marked “pending” because it was flooded.",
        "resolutionNote": "Lane 3 was skipped because it was under water.",
        "caption": "A survey sheet with one lane marked pending"
      }
    },
    {
      "id": "ev-d013-2",
      "title": "Warehouse stock card",
      "source": "Collectorate warehouse",
      "sourceType": "official",
      "time": "09:20",
      "claim": "400 kits received yesterday; none issued; two trucks available.",
      "initialState": "verified",
      "truth": "true",
      "resolvedState": "verified",
      "metadata": [
        {
          "label": "Kits in stock",
          "value": "400"
        },
        {
          "label": "Trucks",
          "value": "2 idle"
        }
      ],
      "visual": {
        "type": "ledger",
        "caption": "A stock card showing 400 kits"
      },
      "resolutionNote": "Four hundred kits and two trucks are waiting at the warehouse.",
      "availableAt": 6,
      "district": "civic",
      "simple": {
        "title": "The warehouse card",
        "claim": "Four hundred kits arrived yesterday. None given out. Two trucks are free.",
        "resolutionNote": "Four hundred kits and two trucks are waiting.",
        "caption": "A stock card showing 400 kits"
      }
    },
    {
      "id": "ev-d013-3",
      "title": "“Double kits” post",
      "source": "Anonymous account",
      "sourceType": "anonymous",
      "time": "08:30",
      "claim": "A photo of kits stacked in a courtyard, captioned “the councillor’s family got double”.",
      "initialState": "unverified",
      "truth": "misleading",
      "resolvedState": "manipulated",
      "metadata": [
        {
          "label": "Courtyard",
          "value": "The relief distribution point, not a home",
          "anomaly": true
        },
        {
          "label": "Stack",
          "value": "Kits awaiting handout, photographed before distribution",
          "anomaly": true
        }
      ],
      "visual": {
        "type": "photo",
        "caption": "Kits stacked in a courtyard"
      },
      "resolutionNote": "The courtyard is the distribution point; the kits were photographed before handout.",
      "injectedBy": "disinfo",
      "contradictedBy": [
        "ev-d013-4"
      ],
      "district": "market",
      "simple": {
        "title": "The “double kits” post",
        "claim": "A photo of stacked kits says the councillor’s family got double.",
        "resolutionNote": "The yard is the handout point. The kits were waiting to be given out.",
        "caption": "Kits stacked in a courtyard"
      }
    },
    {
      "id": "ev-d013-4",
      "title": "Distribution register, Lane 2",
      "source": "Relief distribution team",
      "sourceType": "official",
      "time": "09:40",
      "claim": "180 kits to 180 households, one per household, signed; no name appears twice.",
      "initialState": "verified",
      "truth": "true",
      "resolvedState": "verified",
      "metadata": [
        {
          "label": "Entries",
          "value": "180, signed"
        },
        {
          "label": "Duplicates",
          "value": "None"
        },
        {
          "label": "Copy",
          "value": "Single carbon copy in a wet bag"
        }
      ],
      "visual": {
        "type": "ledger",
        "caption": "A register with thumbprints"
      },
      "resolutionNote": "One kit per household, no duplicates. The only copy is in a wet bag.",
      "availableAt": 10,
      "district": "transit",
      "perishable": true,
      "simple": {
        "title": "The handout register",
        "claim": "One kit per family, 180 families, all signed. No name twice.",
        "resolutionNote": "Nobody got two kits. The only copy is in a wet bag.",
        "caption": "A register with thumbprints"
      }
    },
    {
      "id": "ev-d013-5",
      "title": "Lane 3 residents’ list",
      "source": "Lane 3 residents’ committee",
      "sourceType": "organizer",
      "time": "10:00",
      "claim": "A handwritten list of 212 affected households in Lane 3 with signatures.",
      "initialState": "unverified",
      "truth": "true",
      "resolvedState": "corroborated",
      "metadata": [
        {
          "label": "Households",
          "value": "212"
        },
        {
          "label": "Signatures",
          "value": "Yes, by lane elder"
        }
      ],
      "visual": {
        "type": "document",
        "caption": "A handwritten list with signatures"
      },
      "resolutionNote": "Lane 3 has already done the survey’s work.",
      "availableAt": 16,
      "corroboratedBy": [
        "ev-d013-1"
      ],
      "district": "transit",
      "simple": {
        "title": "Lane 3’s own list",
        "claim": "The lane wrote its own list: 212 families, with signatures.",
        "resolutionNote": "Lane 3 did the survey’s job itself.",
        "caption": "A handwritten list with signatures"
      }
    }
  ],
  "decisions": [
    {
      "id": "d013-1",
      "title": "Lane 3 is at the warehouse gate",
      "situation": "Residents of Lane 3 are outside the warehouse where 400 kits sit unissued. They have their own list.",
      "district": "civic",
      "expiresAfter": 22,
      "defaultOption": "o-d013-1-wait",
      "urgency": "high",
      "options": [
        {
          "id": "o-d013-1-trucks",
          "title": "Load the two trucks for Lane 3 now",
          "preview": "Kits roll to Lane 3 against the residents’ own list, checked at the truck.",
          "authority": "Duty to keep essential services running",
          "tags": [
            "service",
            "relief"
          ],
          "effects": {
            "safety": 5,
            "economy": 5,
            "grievance": 3
          },
          "consequence": "The first kits reach Lane 3 within the hour.",
          "requiresEvidence": [
            "ev-d013-2"
          ],
          "setsFlags": [
            "acknowledged",
            "served",
            "kits-sent"
          ],
          "mapEffects": [
            {
              "kind": "action",
              "district": "transit",
              "action": "relief"
            }
          ]
        },
        {
          "id": "o-d013-1-explain",
          "title": "Show the survey sheet: why Lane 3 was “pending”",
          "preview": "The sheet shows water-logging, not voting, delayed the lane.",
          "authority": "Duty of candour: say what is known and what is not",
          "tags": [
            "transparent",
            "communication"
          ],
          "effects": {
            "trust": 6,
            "evidence": 3,
            "grievance": 5
          },
          "consequence": "The word “pending” gets a reason. The anger has somewhere to go.",
          "requiresEvidence": [
            "ev-d013-1"
          ],
          "setsFlags": [
            "acknowledged"
          ],
          "mapEffects": [
            {
              "kind": "action",
              "district": "civic",
              "action": "announce"
            }
          ]
        },
        {
          "id": "o-d013-1-clear",
          "title": "Clear the gate; official list only",
          "preview": "Police move the residents; kits wait for Thursday’s survey.",
          "authority": "Article 19(2)–(3): restrictions must be reasonable and specific",
          "tags": [
            "suppressive",
            "disproportionate"
          ],
          "effects": {
            "freedom": -12,
            "trust": -9,